{"conclusion":"Bybit Demo explicitly rejected native Futures Grid validation as unsupported; Testnet and mainnet feasibility remain unresolved.","endpoint":"/v5/fgridbot/validate","environment":"demo","evidence_schema":"grid.bybit-fgrid-validate-conclusion/v1","observed_at_utc":"2026-08-12T07:41:19.234192Z","request_summary":{"grid_mode":"neutral","grid_type":"geometric","numeric_encoding":"exact-decimal-and-integer-strings","symbol":"BTCUSDT"},"response_summary":{"check_code":null,"ret_code":10032,"ret_msg":"Demo trading are not supported."},"safety":{"credentials_persisted":false,"mainnet_fallback":false,"mutating_endpoint_called":false,"private_artifact_committed":false,"private_receipt_verified":true,"retry_count":0},"status":"demo-unsupported"}
